{"schema_version":"1.0.0","session_id":"session-synthetic-0001","experience_id":"exp-demo-store","participant_id":null,"experience_config_version":"1.0.0","eligible_studies":[{"study_id":"study-product-evaluation","config_version":"1.0.0","aoi_set_version":"1.0.0","question_set_version":"1.0.0","priority":10}],"privacy_notice_version":"1.0.0","research_consent_version":"1.0.0","camera_capture_supported":true,"issued_at":"2026-01-01T10:00:00Z","expires_at":"2026-01-01T11:00:00Z"}
